{
  "$schema": "https://json-schema.org/draft/2020-12/schema",
  "type": "object",
  "required": ["overview", "objectives", "scope", "features"],
  "additionalProperties": false,
  "properties": {
    "overview": { "type": "string", "minLength": 1 },
    "objectives": { "type": "array", "items": { "type": "string" }, "minItems": 1 },
    "scope": { "type": "string", "minLength": 1 },
    "features": {
      "type": "array",
      "minItems": 1,
      "items": {
        "type": "object",
        "required": ["name", "description", "acceptance_criteria"],
        "additionalProperties": false,
        "properties": {
          "name": { "type": "string", "minLength": 1 },
          "description": { "type": "string", "minLength": 1 },
          "acceptance_criteria": {
            "type": "array",
            "items": { "type": "string" },
            "minItems": 1
          }
        }
      }
    }
  }
}
